{
  "$schema": "https://json-schema.org/draft/2020-12/schema",
  "schema": "graphforge-progressive-host-run-result-schema/1",
  "type": "object",
  "additionalProperties": false,
  "required": ["schema", "rung", "status", "failure", "identities", "artifacts", "claim"],
  "properties": {
    "schema": {"const": "graphforge-progressive-host-run-result/1"},
    "rung": {"enum": ["S18", "S19", "S20", "S22", "S24", "S25", "S26"]},
    "status": {"enum": ["passed", "failed"]},
    "failure": {
      "enum": [
        null,
        "native_authority_unavailable",
        "staging_failed",
        "execution_boundary_failed",
        "benchexec_failed",
        "host_swapped",
        "host_swap_unavailable",
        "rung_wall_exceeded",
        "rung_phase_failed",
        "ordinary_receipt_missing",
        "stored_plan_mismatch",
        "projection_refused",
        "work_root_invalid"
      ]
    },
    "failed_phase": {
      "enum": ["admission", "generate", "ingest", "reopen", "recount", "query", "export", "verify", "clean_import", "reopen_proof"]
    },
    "error_tail": {"type": "string", "minLength": 1, "maxLength": 1024},
    "identities": {
      "type": "object",
      "additionalProperties": false,
      "required": [
        "commit",
        "host_profile_id",
        "host_profile_sha256",
        "profile_id",
        "profile_sha256",
        "generator",
        "generator_executable_sha256",
        "gf_sha256",
        "certify_sha256",
        "benchexec_python_sha256",
        "benchexec_version"
      ],
      "properties": {
        "commit": {"type": "string", "pattern": "^[0-9a-f]{40}$"},
        "producer_sha256": {"$ref": "#/$defs/digest"},
        "host_profile_id": {"const": "local-linux-cgroups-v2"},
        "host_profile_sha256": {"$ref": "#/$defs/digest"},
        "profile_id": {
          "enum": [
            "graph500-s18-local",
            "graph500-s19-local",
            "graph500-s20-provider",
            "graph500-s22-provider",
            "graph500-s24-provider",
            "graph500-s25-provider",
            "graph500-s26-provider"
          ]
        },
        "profile_sha256": {"$ref": "#/$defs/digest"},
        "generator": {"type": "string", "pattern": "^sha256:[0-9a-f]{64}$"},
        "generator_executable_sha256": {"$ref": "#/$defs/digest"},
        "gf_sha256": {"$ref": "#/$defs/digest"},
        "certify_sha256": {"$ref": "#/$defs/digest"},
        "benchexec_python_sha256": {"$ref": "#/$defs/digest"},
        "benchexec_version": {"type": "string", "pattern": "^[0-9]+(\\.[0-9]+)+$"},
        "admitted_projection_sha256": {"$ref": "#/$defs/digest"}
      }
    },
    "artifacts": {
      "oneOf": [
        {"type": "null"},
        {
          "type": "object",
          "additionalProperties": false,
          "required": ["plan_sha256", "benchexec_sha256", "graphforge_sha256", "rung_sha256"],
          "properties": {
            "plan_sha256": {"$ref": "#/$defs/digest"},
            "benchexec_sha256": {"$ref": "#/$defs/digest"},
            "graphforge_sha256": {"$ref": "#/$defs/digest"},
            "rung_sha256": {"$ref": "#/$defs/digest"}
          }
        }
      ]
    },
    "claim": {"const": "engineering_evidence_only"}
  },
  "allOf": [
    {
      "if": {"properties": {"status": {"const": "passed"}}, "required": ["status"]},
      "then": {"properties": {"failure": {"type": "null"}, "artifacts": {"type": "object"}}},
      "else": {"properties": {"failure": {"type": "string"}, "artifacts": {"type": "null"}}}
    },
    {
      "if": {"properties": {"failure": {"const": "rung_phase_failed"}}, "required": ["failure"]},
      "then": {"required": ["failed_phase"]},
      "else": {"not": {"anyOf": [{"required": ["failed_phase"]}, {"required": ["error_tail"]}]}}
    },
    {
      "if": {"properties": {"rung": {"enum": ["S20", "S22", "S24", "S25", "S26"]}}, "required": ["rung"]},
      "then": {
        "properties": {
          "identities": {"required": ["admitted_projection_sha256"]}
        }
      }
    }
  ],
  "$defs": {"digest": {"type": "string", "pattern": "^[0-9a-f]{64}$"}}
}
