{
  "artifacts": {
    "benchexec_sha256": "acd7b01aea8ed552287a29de0b625b57cef64880d097110558aa796108e5f8af",
    "graphforge_sha256": "eb861f2e5053ae2239b671d6d374706ad749a0180ccaacf5b7fcd42d120ad3e7",
    "plan_sha256": "ebbd0a6c05927678eb2474857ec04b0a07e08766b056a7e109477158e7a6c3fd",
    "rung_sha256": "f5628c72c50bbfa3e7adb02f9bc62ee88200b2c7320af2786e02dd50ca6c9cf5"
  },
  "claim": "engineering_evidence_only",
  "failure": null,
  "identities": {
    "benchexec_python_sha256": "52e0a13e60a981d8c4b6478be2ba5176f69da07948a056bf49cf6f077e30cb41",
    "benchexec_version": "3.35",
    "certify_sha256": "578b64c91590c1d93be1a36c89c3c88374907b38661651287d32a1c50457f369",
    "commit": "710c6c64f4718c0664d08bdd3aafe21de4a29eba",
    "generator": "sha256:a7cd8397ce191c48094d8812eb43dfc894084645dd439e76fb8704b35bb61fdc",
    "generator_executable_sha256": "4829806c4666d1c21e2afd680fec3c8749588be713e493233e81b77eb2bcf551",
    "gf_sha256": "18625f292da44d70c22e7c51190996efed3a1a874f5deafac1eaa264438b9eba",
    "host_profile_id": "local-linux-cgroups-v2",
    "host_profile_sha256": "21cbcd01a0896ad8ed9d4aae1ab933cb143d41636fdf66297ead9bb89c3681bf",
    "producer_sha256": "5ca3af64ae7a0a45221cdafdcabce2bfa700975e19f1ccb9557269cecef92bf1",
    "profile_id": "graph500-s19-local",
    "profile_sha256": "63213dc0c7d6fe95280dbe1149dd7a39bc21a880a9d5f2a98d1f226b4a251d00"
  },
  "rung": "S19",
  "schema": "graphforge-progressive-host-run-result/1",
  "status": "passed"
}
